<?xml version="1.0"?>
<!--
To change this license header, choose License Headers in Project Properties.
To change this template file, choose Tools | Templates
and open the template in the editor.
-->
<xs:schema version="1.0"
           xmlns:xs="http://www.w3.org/2001/XMLSchema"
           elementFormDefault="qualified">
<xs:element name="reservations">
    <xs:complexType>
        <xs:sequence>
            <xs:element name = "reservation" minOccurs="2" maxOccurs="unbounded">
                <xs:complexType>
                    <xs:sequence>
                        <xs:element type="xs:String" name="title"/>
                        <xs:element type="xs:String" name="username"/>
                        <xs:element type="xs:String" name="email"/>
                    </xs:sequence>
                </xs:complexType>
            </xs:element>
        </xs:sequence>
    </xs:complexType>
</xs:element>
</xs:schema>